<?xml version="1.0" encoding="UTF-8"?>


<root
    xmlns:xsi='http://www.w3.org/2001/XMLSchema-instance'
    xsi:noNamespaceSchemaLocation='levels.xsd'>
    <level>
        <height>6</height>
        <width>6</width>
        <exitRow>2</exitRow>
        <exitCol>5</exitCol>
        <cars>
            <car>
                <id>1</id>
                <size>2</size>
                <orientation>HORIZONTAL</orientation>
                <row>0</row>
                <col>0</col>
            </car>
            <car>
                <id>2</id>
                <size>2</size>
                <orientation>VERTICAL</orientation>
                <row>1</row>
                <col>0</col>
            </car>
        </cars>
        <redCar>
            <redCarId>R</redCarId>
            <redCarSize>2</redCarSize>
            <redCarOrientation>HORIZONTAL</redCarOrientation>
            <redCarRow>2</redCarRow>
            <redCarCol>1</redCarCol>
        </redCar>
    </level>
    <level>
        <height>7</height>
        <width>7</width>
        <exitRow>3</exitRow>
        <exitCol>6</exitCol>
        <cars>
            <car>
                <id>3</id>
                <size>2</size>
                <orientation>VERTICAL</orientation>
                <row>1</row>
                <col>0</col>
            </car>
        </cars>
        <redCar>
            <redCarId>R</redCarId>
            <redCarSize>2</redCarSize>
            <redCarOrientation>HORIZONTAL</redCarOrientation>
            <redCarRow>3</redCarRow>
            <redCarCol>0</redCarCol>
        </redCar>
    </level>
</root>
